{"finalized":true,"generated_at":"2026-07-11T12:01:00Z","policy_observation":{"compression":"zstd","recording_mode":"bounded","remote_sink_used":false,"spool_peak_size_bytes":3072,"upload_lag_max_sec":1,"upload_mode":"local_only"},"run_id":"run-00000000-0000-4000-8000-000000000001","schema_version":"evidence-index.v2","segments":[{"checksum_verified":true,"local_path":"/evidence/worker.mcap","mcap_summary":{"media_type":"application/vnd.robotics.mcap-summary.v1+json","sha256":"f29a85f0aa61e0930f9895aa88472da4077db826dfcf93dfb1ae1d34df498db5","size_bytes":438,"uri":"file:///evidence/worker.summary.json"},"media_type":"application/mcap","retention_class":"pull-request-7d","segment_index":0,"sha256":"d2fb8049b5c34591bf1dc1c43419b163d057e69bd6d4dbcc3fe5204f7047b850","size_bytes":24,"upload_status":"local","uri":"file:///evidence/worker.mcap"},{"checksum_verified":true,"local_path":"/evidence/worker.otlp.jsonl","media_type":"application/x-ndjson","retention_class":"pull-request-7d","segment_index":3,"sha256":"8088ea70d167678d946e46ec0eb573ddcea9d0c2d6bfa3168b088dfb04a4d186","size_bytes":72,"upload_status":"local","uri":"file:///evidence/worker.otlp.jsonl"}]}
